<?xml version="1.0" encoding="UTF-8" standalone="no"?>
<voidwear xmlns:xsi="http://www.w3.org/2001/XMLSchema-instance" xsi:noNamespaceSchemaLocation="voidwear.xsd">
  <productos>
    <producto id="1">
      <nombre>Producto1</nombre>
      <precio>60.03</precio>
      <categoria>Camisetas</categoria>
      <talla>XL</talla>
      <color>Rojo</color>
      <stock>31</stock>
    </producto>
    <producto id="3">
      <nombre>Producto3</nombre>
      <precio>70.61</precio>
      <categoria>Camisetas</categoria>
      <talla>S</talla>
      <color>Blanco</color>
      <stock>44</stock>
    </producto>
    <producto id="4">
      <nombre>Producto4</nombre>
      <precio>59.56</precio>
      <categoria>Zapatillas</categoria>
      <talla>M</talla>
      <color>Negro</color>
      <stock>38</stock>
    </producto>
    <producto id="5">
      <nombre>Producto5</nombre>
      <precio>73.68</precio>
      <categoria>Accesorios</categoria>
      <talla>L</talla>
      <color>Negro</color>
      <stock>15</stock>
    </producto>
    <producto id="6">
      <nombre>Producto6</nombre>
      <precio>54.81</precio>
      <categoria>Sudaderas</categoria>
      <talla>XL</talla>
      <color>Rojo</color>
      <stock>31</stock>
    </producto>
    <producto id="7">
      <nombre>Producto7</nombre>
      <precio>83.03</precio>
      <categoria>Pantalones</categoria>
      <talla>M</talla>
      <color>Gris</color>
      <stock>25</stock>
    </producto>
    <producto id="8">
      <nombre>Producto8</nombre>
      <precio>92.66</precio>
      <categoria>Camisetas</categoria>
      <talla>M</talla>
      <color>Rojo</color>
      <stock>16</stock>
    </producto>
    <producto id="9">
      <nombre>Producto9</nombre>
      <precio>98.12</precio>
      <categoria>Zapatillas</categoria>
      <talla>L</talla>
      <color>Verde</color>
      <stock>31</stock>
    </producto>
    <producto id="10">
      <nombre>Producto10</nombre>
      <precio>75.14</precio>
      <categoria>Sudaderas</categoria>
      <talla>L</talla>
      <color>Gris</color>
      <stock>43</stock>
    </producto>
    <producto id="11">
      <nombre>Producto11</nombre>
      <precio>61.88</precio>
      <categoria>Pantalones</categoria>
      <talla>S</talla>
      <color>Blanco</color>
      <stock>29</stock>
    </producto>
    <producto id="12">
      <nombre>Producto12</nombre>
      <precio>42.89</precio>
      <categoria>Pantalones</categoria>
      <talla>M</talla>
      <color>Rojo</color>
      <stock>15</stock>
    </producto>
    <producto id="13">
      <nombre>Producto13</nombre>
      <precio>45.46</precio>
      <categoria>Sudaderas</categoria>
      <talla>XL</talla>
      <color>Gris</color>
      <stock>8</stock>
    </producto>
    <producto id="14">
      <nombre>Producto14</nombre>
      <precio>88.75</precio>
      <categoria>Sudaderas</categoria>
      <talla>M</talla>
      <color>Verde</color>
      <stock>33</stock>
    </producto>
    <producto id="15">
      <nombre>Producto15</nombre>
      <precio>14.61</precio>
      <categoria>Sudaderas</categoria>
      <talla>S</talla>
      <color>Gris</color>
      <stock>35</stock>
    </producto>
    <producto id="16">
      <nombre>Camiseta VOIDWEAR</nombre>
      <precio>999.99</precio>
      <categoria>Camisetas</categoria>
      <talla>L</talla>
      <color>Negro</color>
      <stock>99</stock>
    </producto>
    <producto id="17">
      <nombre>Camiseta VOIDWEAR</nombre>
      <precio>39.95</precio>
      <categoria>Camisetas</categoria>
      <talla>L</talla>
      <color>Negro</color>
      <stock>25</stock>
    </producto>
    <producto id="18">
      <nombre>pantalones</nombre>
      <precio>1111.01</precio>
      <categoria>Pantalones</categoria>
      <talla>L</talla>
      <color>Negro</color>
      <stock>111111111</stock>
    </producto>
  </productos>
  <usuarios>
    <usuario correo="aitor@voidwear.com">
      <nombre>Aitor</nombre>
      <rol>GESTOR</rol>
    </usuario>
    <usuario correo="lara@voidwear.com">
      <nombre>lara</nombre>
      <rol>GESTOR</rol>
    </usuario>
    <usuario correo="lucia@voidwear.com">
      <nombre>Lucía</nombre>
      <rol>EMPLEADO</rol>
    </usuario>
    <usuario correo="raul@voidwear.com">
      <nombre>Raúl</nombre>
      <rol>CLIENTE</rol>
    </usuario>
  </usuarios>
  <clientes>
    <cliente id="1">
      <direccion>Calle Falsa 1, Ciudad</direccion>
      <telefono>679490639</telefono>
      <id_usuario>3</id_usuario>
    </cliente>
    <cliente id="2">
      <direccion>Calle Falsa 2, Ciudad</direccion>
      <telefono>636436524</telefono>
      <id_usuario>4</id_usuario>
    </cliente>
    <cliente id="3">
      <direccion>Calle Falsa 3, Ciudad</direccion>
      <telefono>624993753</telefono>
      <id_usuario>5</id_usuario>
    </cliente>
    <cliente id="4">
      <direccion>Calle Falsa 4, Ciudad</direccion>
      <telefono>651195376</telefono>
      <id_usuario>6</id_usuario>
    </cliente>
    <cliente id="5">
      <direccion>Calle Falsa 5, Ciudad</direccion>
      <telefono>624191523</telefono>
      <id_usuario>7</id_usuario>
    </cliente>
    <cliente id="6">
      <direccion>Calle Falsa 6, Ciudad</direccion>
      <telefono>606021596</telefono>
      <id_usuario>8</id_usuario>
    </cliente>
    <cliente id="7">
      <direccion>Calle Falsa 7, Ciudad</direccion>
      <telefono>621349927</telefono>
      <id_usuario>9</id_usuario>
    </cliente>
    <cliente id="8">
      <direccion>Calle Falsa 8, Ciudad</direccion>
      <telefono>662447540</telefono>
      <id_usuario>10</id_usuario>
    </cliente>
    <cliente id="9">
      <direccion>Calle Falsa 9, Ciudad</direccion>
      <telefono>649173065</telefono>
      <id_usuario>11</id_usuario>
    </cliente>
    <cliente id="10">
      <direccion>Calle Falsa 10, Ciudad</direccion>
      <telefono>627757615</telefono>
      <id_usuario>12</id_usuario>
    </cliente>
    <cliente id="11">
      <direccion>Calle Falsa 11, Ciudad</direccion>
      <telefono>676489444</telefono>
      <id_usuario>13</id_usuario>
    </cliente>
    <cliente id="12">
      <direccion>Calle Falsa 12, Ciudad</direccion>
      <telefono>659186399</telefono>
      <id_usuario>14</id_usuario>
    </cliente>
    <cliente id="13">
      <direccion>Calle Falsa 13, Ciudad</direccion>
      <telefono>652276679</telefono>
      <id_usuario>15</id_usuario>
    </cliente>
    <cliente id="14">
      <direccion>Calle Falsa 14, Ciudad</direccion>
      <telefono>649064881</telefono>
      <id_usuario>16</id_usuario>
    </cliente>
    <cliente id="15">
      <direccion>Calle Falsa 15, Ciudad</direccion>
      <telefono>619878066</telefono>
      <id_usuario>17</id_usuario>
    </cliente>
    <cliente id="16">
      <direccion>Calle Falsa 16, Ciudad</direccion>
      <telefono>635087703</telefono>
      <id_usuario>18</id_usuario>
    </cliente>
    <cliente id="17">
      <direccion>Calle Falsa 17, Ciudad</direccion>
      <telefono>640421269</telefono>
      <id_usuario>19</id_usuario>
    </cliente>
    <cliente id="18">
      <direccion>Calle Falsa 18, Ciudad</direccion>
      <telefono>605547901</telefono>
      <id_usuario>20</id_usuario>
    </cliente>
    <cliente id="19">
      <direccion>Calle Falsa 19, Ciudad</direccion>
      <telefono>654749317</telefono>
      <id_usuario>21</id_usuario>
    </cliente>
    <cliente id="20">
      <direccion>Calle Falsa 20, Ciudad</direccion>
      <telefono>644373150</telefono>
      <id_usuario>22</id_usuario>
    </cliente>
    <cliente id="21">
      <direccion>Calle Falsa 21, Ciudad</direccion>
      <telefono>607823869</telefono>
      <id_usuario>23</id_usuario>
    </cliente>
    <cliente id="22">
      <direccion>Calle Falsa 22, Ciudad</direccion>
      <telefono>622567763</telefono>
      <id_usuario>24</id_usuario>
    </cliente>
    <cliente id="23">
      <direccion>Calle Falsa 23, Ciudad</direccion>
      <telefono>698127272</telefono>
      <id_usuario>25</id_usuario>
    </cliente>
    <cliente id="24">
      <direccion>Calle Falsa 24, Ciudad</direccion>
      <telefono>629683817</telefono>
      <id_usuario>26</id_usuario>
    </cliente>
    <cliente id="25">
      <direccion>Calle Falsa 25, Ciudad</direccion>
      <telefono>664728822</telefono>
      <id_usuario>27</id_usuario>
    </cliente>
    <cliente id="26">
      <direccion>Calle Falsa 26, Ciudad</direccion>
      <telefono>671211477</telefono>
      <id_usuario>28</id_usuario>
    </cliente>
    <cliente id="27">
      <direccion>Calle Falsa 27, Ciudad</direccion>
      <telefono>616083076</telefono>
      <id_usuario>29</id_usuario>
    </cliente>
    <cliente id="28">
      <direccion>Calle Falsa 28, Ciudad</direccion>
      <telefono>670630652</telefono>
      <id_usuario>30</id_usuario>
    </cliente>
    <cliente id="29">
      <direccion>Calle Falsa 29, Ciudad</direccion>
      <telefono>687332915</telefono>
      <id_usuario>31</id_usuario>
    </cliente>
    <cliente id="30">
      <direccion>Calle Falsa 30, Ciudad</direccion>
      <telefono>684065895</telefono>
      <id_usuario>32</id_usuario>
    </cliente>
    <cliente id="31">
      <direccion>Calle Falsa 31, Ciudad</direccion>
      <telefono>629517549</telefono>
      <id_usuario>33</id_usuario>
    </cliente>
    <cliente id="32">
      <direccion>Calle Falsa 32, Ciudad</direccion>
      <telefono>636684917</telefono>
      <id_usuario>34</id_usuario>
    </cliente>
    <cliente id="33">
      <direccion>Calle Falsa 33, Ciudad</direccion>
      <telefono>616601034</telefono>
      <id_usuario>35</id_usuario>
    </cliente>
    <cliente id="34">
      <direccion>Calle Falsa 34, Ciudad</direccion>
      <telefono>628083127</telefono>
      <id_usuario>36</id_usuario>
    </cliente>
    <cliente id="35">
      <direccion>Calle Falsa 35, Ciudad</direccion>
      <telefono>629551693</telefono>
      <id_usuario>37</id_usuario>
    </cliente>
    <cliente id="36">
      <direccion>Calle Falsa 36, Ciudad</direccion>